,Titulo,Tipo,Tags,Nivel Educativo,Categoria,Descripcion,Ubicacion,Fecha Inicio,Fecha Final,Requisitos,Url de IMAGEN,Url (PAGINA WEB),Carreras,Idiomas,Semestre,Vacantes,Calificacion,Premio,Remuneracion,Costo
13,Creative Entrepreneur Accelerator Grant Program 2022,Beca," Tags: Academic Jobs, career opportunities, Competitions and Awards, fellow opportunities Opportunities for youths, Fellowships, Fellowships 2020, fully funded, fully funded fellowships, fully funded opportunities, fully funded scholarships, funded fellowship, Funded Fellowships, funded opportunities, international fellowships, International Scholarships, opportunities, opportunities for entrepreneurs, opportunities for students, opportunities for youths, Opportunity, opportunity for student, oya opportunities, oyaop, oyaop.com, www.oyaop.com, youths",Universidad,Emprendimiento,"Applications for theÂ Creative Entrepreneur Accelerator Grant Program 2022Â are now open. The Creative Entrepreneur Accelerator Grant Program provides creative entrepreneurs with small business consulting and up to $2,000 in critical financial resources to grow businesses and revenue. Fifty-one percent of the funds available for distribution in this program will be reserved for Black, indigenous, or persons of color (BIPOC), or individuals residing in communities identified by the Small Business Administrationâs low-income communities map. The Arts Council is administering this grant on behalf of the PA Council on the Arts for Allegheny, Beaver, Greene, and Washington counties.See More: Goethe-Institut Visual Arts Project Fund 2022Benefit From Creative Entrepreneur Accelerator GrantThis grant program offers $500 to $2,000 in support of creative entrepreneurs starting a business or currently operating a micro-business with gross revenue less than $200,000 in Allegheny, Beaver, Greene, and Washington counties.",-,DeadlineVaries,-," Required for Creative Entrepreneur Accelerator GrantApplicants must:  Be 18 years of age or older and live in Allegheny, Beaver, Greene, or Washington countiesManage a business with gross revenue of less than $200,000 or intend to form or operate a business in PennsylvaniaOperate in one or more of the following creative industries:Firstly, Marketing â Advertising and marketing agencies and professionalsSecondly, Architecture â Architecture firms and architectsThirdly, Visual Arts & Crafts â Galleries, artists, artisans, and makersAdditionally, Design â Product, interior, graphic, and fashion design firms and designersMoreover, Film & Media â Film, video, animation, television, and radio businessesDigital Games â Companies, programmers, and individuals producing games.Music & Entertainment â Producers, venues, musicians, and performersPublishing â Print or electronic businesses and content creators, editors, and writersApplication of Creative Entrepreneur Accelerator GrantStep 1:Â Referral Coordinator Business Plan Consultation: Before applying, all applicants must first have a consultation. And business plan review with a local small business development organization, known as a Referral Coordinator. The Referral Coordinators will help with the logistics of starting a business including the development of a business plan and growth strategies.Step 2: Application: Upon receiving an approved referral form from a designated Referral Coordinator. Applicants may submit application materials through the Arts Council website. Submissions must include the creative entrepreneurâs application form, approved referral form, and business plan, including a budget outlining expected project expenses for the funding year. Upon receipt of an eligible and complete application, the Arts Council will review your application. If approved, the Arts Council will enter into a grant award agreement with the creative entrepreneur and process the grant payment.Applications open on October 11, 2021. Applications will be accepted on a rolling basis. Funding decisions will be made on a quarterly basis, on the 15th of each month: November 2021, February 2022, May 2022, and August 2022.See More: GIST Scholarship in South Korea 2022 â Fully FundedLastly, It is important to visit the official website link found below to access the application form.  Correspondingly, Join us onÂ TelegramÂ for more opportunities!Similarly, VisitÂ oyaop.comÂ andÂ oyaschool.comÂ for more scholarship opportunities.",-,https://www.pittsburghartscouncil.org/grants/creative-entrepreneur-accelerator,-,Inglés,-,-,-,-,-,-
14,Oracle for Startups|| Offer in Cloud Computing,Beca," Tags: 2022, career opportunities, Cloud Computing, entrepreneurship, funded opportunities, opportunities, opportunities for entrepreneurs, opportunities for youths, Opportunity, Opportunity for Africans, Oracle, Oracle for Startups, oya opportunities, oyaop, oyaop.com, Social entrepreneurs, Sustainable Development, Sustainable development goals, UN Sustainable Development Goals, www.oyaop.com, youths",Universidad,Emprendimiento,"Oracle for Startups offers the opportunity for fledgling businesses to experience the benefits of cloud computing at affordable prices while supporting their growth with a comprehensive program of complementary go-to-market features.To fuel the growth of startups across Africa, Oracle is providing extra resources and support to technology startups. Cloud credits of up to $10,000 per startupÂ are available as well as hands-on technical support, executive mentoring, go-to-market resources, and customer engagements.Click: C3 Impact Accelerator Program 2022  ",-,-,-,"Startups must have been founded within the last 10 years, and have a functioning website or public profile andÂ LinkedIn profile of the applicantMust be a registered startup business in AfricaStartups must be associated withÂ one or more of the following: accelerators, seed/venture capital firms, and startup enabling organizations/initiativesStartups who have already graduated from the Oracle for Startups program, public companies, existing Oracle customers (including their subsidiaries), and Oracle Partner Network members are not eligible for this offerThe initiative is open to net-new startupsÂ from 01 February 2022 and is valid for two years from the enrollment dateAlso check: [email protected] Digital Innovations for Business Resilience Benefits70% discount on the cloud from day 1$500 of free cloud credits (with the option to apply for more)Migration and technical support with live monthly webinarsAccess to experienced mentoring and a virtual curriculumExposure via global marketing, events, and PR teamsOpportunities to engage with Oracleâs more than 430,000 customersYou might also like: iHatch Startup Incubation Programme   How to ParticipateSign up at oracle.com/startupReceive free cloud credits and a 70% discountFinally, start building!   ",-,https://www.oraclestartups.tech/cloudcreditsforAfrica,-,Inglés,-,-,-,-,-,-
15,GSMA Innovation Fund for Climate Resilience and Adaptation,Beca," Tags: career opportunities, Competitions and Awards, fully funded, fully funded opportunities, funded opportunities, Grant 2022, GSMA, GSMA Grant, GSMA Grant 2022, GSMA Innovation Fund for Climate Resilience and Adaptation, opportunities, opportunities for students, opportunities for youths, Opportunity, opportunity for student, oya opportunities, oyaop, oyaop.com, www.oyaop.com, youths",Universidad,Emprendimiento,Apply for the GSMA Innovation Fund for Climate Resilience and Adaptation this 2022. The GSMA is a new member of the Adaptation Research Alliance (ARA); a global collaborative effort to increase investment and capacity for action-orientated research to support effective adaptation to climate change. It supports ARAâs best practice to find innovative as well as participative ways for incorporating the voice and views of local communities as it empowers them to participate as equal partners in adaptation processes.Also check: Fully Funded Africa Health Research Institute Scholarships 2022/23,-,"Deadline23 January,2023",-,"The GSMA is looking for start-ups, small and medium enterprises (SMEs) and social enterprises that leverage digital technology, particularly mobile, to deliver climate resilience and adaptation solutions to and with low-income and vulnerable populations.  PrizeSuccessful projects will receive an equity-free grant of betweenÂ Â£100,000 and Â£250,000Â to scale their innovation over a 15 to 18 month period.Also check: Fully Funded Mahmoud S. Rabbani Scholarships 2022BenefitsIn addition to the financial compensation, grantees will receive further support, including but not limited to:  Learning exchange opportunities with other grantees as well as GSMA networksFacilitation of relationships with mobile operators and public sector organisationsAlso, profiling opportunities through GSMA publications, social media as well as industry-leading MWC events.Climate resilience and adaptation solutionsClimate resilience and adaptation solutions are defined as those that help to build individual, community or institutional capacities to:AdaptÂ to multiple, long-term and future climate change risks;Anticipate as well as reduce the impact of climate variability and extremes through preparedness and planningAlso, Absorb (i.e. face and manage) adverse conditions, emergencies or disasters.Also check out: Funded Stanford University/LSHTM Planetary Fellowships 2022Additional informationIf you would like to know more about the GSMA Innovation Fund for Climate Resilience and Adaptation, find more details in the links below.FAQsTerms and Conditions+ EligibilityLaunch blogWebinar slidesWebinar recordingApply now",-,https://gsma.forms.fm/gsma-innovation-fund-for-climate-resilience-and-adaptation/forms/8998,-,Inglés,-,-,-,-,-,-
16,Top 5 Entrepreneurship Events You need to Sign up in January 2022,Beca,-,Universidad,Emprendimiento,"With a new year, create new resolutions for your business with these Entrepreneurship Events! Grab your opportunity to learn and grow your business with professional events as well as workshops. Here are the top five lists of Entrepreneurship Events you can register yourself with this month. Get a chance to expand your knowledge and also the connection around the globe!5. Fully Funded Savvy Global Fellowship 2022 for Aspiring Entrepreneurs   Savvy is a global virtual Fellowship program, available in 104 languages, for passionate and brilliant young individuals seeking to be part of the new generation of impact entrepreneurs. As a Savvy Fellow, you will be provided with the knowledge, skills, tools, resources, support network, and community to build a sustainable, innovative, and profitable impact-driven business.Application Deadline: ongoing  Organiser: Savvy Business Incubation and Acceleration LimitedField: Early-Stage EntrepreneursClick here for more information 4. AWS Robotics Startup Accelerator | A path to successful Startup The AWS Robotics Startup Accelerator is a four-week technical, business, and mentorship opportunity open to robotics startups from around the globe. The program will provide resources to a select cohort of startups seeking to use AWS to help them solve their robotics development, deployment, as well as management challenges. You can gain up to $10,000 in promotional credits for use of AWS IoT, Robotics and ML services.Application Deadline: 16 January 2022Organiser: AmazonField: Â Robotics StartupsClick here for more information 3. E4Impact Accelerator 2.0 || Startup funding Program E4Impact Foundation is the leading Alliance of Universities, Companies as well as Institutions to grow a new generation of African impact entrepreneurs and to promote Partnerships between Europe and Africa.You will gain Professional services, Investment support, links to investors, funds, training and also opportunity to grow in new markets as well asÂ training sessions about Organic Farming.Application Deadline: 30 January 2022Organiser: E4Impact Accelerator ProgramField: Â Enterprises in KenyaClick Â hereÂ  for more information 2. Sanabil 500 MENA Seed Accelerator: Take your Startup to Next Level Sanabil 500 Global MENA is looking for the next generation of talented entrepreneurs through this brand new program designed for tech startups with early traction. You will gain mentorship and programming for 12 weeks from 500 Global mentors, an investment of $100,000 as well as access to 500âs global network of founders, community events, partners and more.Application Deadline: 15 January 2022Organiser: 500 GlobalField: Startup with a Minimum Viable ProductClick here for more information 1. Asia Trade Week 2022 Economist Impactâs Asia Trade Week 2022, seeks to answer the questions related to trade, policies, sustainable development and business, building on its records. It will convene business leaders, trade negotiators, policymakers, academics and experts for a week of rigorous discussion and debate on the most important issues surrounding Asian trade and business.You will gain unlimited networking at no cost, understanding of trade contribution to global economic recovery and much more.Application Deadline: ongoingOrganiser: Economist ImpactField: trade, policies, sustainable development, businessClick here for more information.",-,-,-,"    DetailsWith a new year, create new resolutions for your business with these Entrepreneurship Events! Grab your opportunity to learn and grow your business with professional events as well as workshops. Here are the top five lists of Entrepreneurship Events you can register yourself with this month. Get a chance to expand your knowledge and also the connection around the globe!5. Fully Funded Savvy Global Fellowship 2022 for Aspiring Entrepreneurs   Savvy is a global virtual Fellowship program, available in 104 languages, for passionate and brilliant young individuals seeking to be part of the new generation of impact entrepreneurs. As a Savvy Fellow, you will be provided with the knowledge, skills, tools, resources, support network, and community to build a sustainable, innovative, and profitable impact-driven business.Application Deadline: ongoing  Organiser: Savvy Business Incubation and Acceleration LimitedField: Early-Stage EntrepreneursClick here for more information 4. AWS Robotics Startup Accelerator | A path to successful Startup The AWS Robotics Startup Accelerator is a four-week technical, business, and mentorship opportunity open to robotics startups from around the globe. The program will provide resources to a select cohort of startups seeking to use AWS to help them solve their robotics development, deployment, as well as management challenges. You can gain up to $10,000 in promotional credits for use of AWS IoT, Robotics and ML services.Application Deadline: 16 January 2022Organiser: AmazonField: Â Robotics StartupsClick here for more information 3. E4Impact Accelerator 2.0 || Startup funding Program E4Impact Foundation is the leading Alliance of Universities, Companies as well as Institutions to grow a new generation of African impact entrepreneurs and to promote Partnerships between Europe and Africa.You will gain Professional services, Investment support, links to investors, funds, training and also opportunity to grow in new markets as well asÂ training sessions about Organic Farming.Application Deadline: 30 January 2022Organiser: E4Impact Accelerator ProgramField: Â Enterprises in KenyaClick Â hereÂ  for more information 2. Sanabil 500 MENA Seed Accelerator: Take your Startup to Next Level Sanabil 500 Global MENA is looking for the next generation of talented entrepreneurs through this brand new program designed for tech startups with early traction. You will gain mentorship and programming for 12 weeks from 500 Global mentors, an investment of $100,000 as well as access to 500âs global network of founders, community events, partners and more.Application Deadline: 15 January 2022Organiser: 500 GlobalField: Startup with a Minimum Viable ProductClick here for more information 1. Asia Trade Week 2022 Economist Impactâs Asia Trade Week 2022, seeks to answer the questions related to trade, policies, sustainable development and business, building on its records. It will convene business leaders, trade negotiators, policymakers, academics and experts for a week of rigorous discussion and debate on the most important issues surrounding Asian trade and business.You will gain unlimited networking at no cost, understanding of trade contribution to global economic recovery and much more.Application Deadline: ongoingOrganiser: Economist ImpactField: trade, policies, sustainable development, businessClick here for more information.",-,https://oyaop.com/opportunities/entrepreneurship-events/,-,Inglés,-,-,-,-,-,-
17,Fully Funded Savvy Global Fellowship 2022 for Aspiring Entrepreneurs,Beca," Tags: Academic Jobs, career opportunities, Competitions and Awards, fellow opportunities Opportunities for youths, Fellowships, Fellowships 2020, fully funded, fully funded fellowships, fully funded opportunities, fully funded scholarships, funded fellowship, Funded Fellowships, funded opportunities, international fellowships, International Scholarships, opportunities, opportunities for entrepreneurs, opportunities for students, opportunities for youths, Opportunity, opportunity for student, oya opportunities, oyaop, oyaop.com, www.oyaop.com, youths",Universidad,Emprendimiento,"Application for theÂ 2022 Savvy Global Fellowship Program for Aspiring and Early-Stage Entrepreneurs is now open! Are you passionate about solving some of the worldâs most pressing problems through innovation? Have you ever wanted to build a successful impact-driven business, but didnât know how to? Do you own an early-stage business that you want to grow and scale into new markets and verticals? Are you interested in being part of the new generation of impact-driven entrepreneurs? Then apply now! Savvy is looking for you. See More: Fully Funded United Nations University (UNU) MSc Scholarships 2022Savvy is a global virtual Fellowship program, available in 104 languages, for passionate and brilliant young individuals seeking to be part of the new generation of impact entrepreneurs. Due to the COVID-19 pandemic, many have lost their jobs and are now living in an uncertain world. Savvy Fellowship is equipping these individuals with the necessary knowledge and skill they need to start their own impact-driven business and succeed as entrepreneurs. As a Savvy Fellow, you will be provided with the knowledge, skills, tools, resources, support network, and community to build a sustainable, innovative, and profitable impact-driven business.Savvy Global FellowshipSome of the things youâll learn as a Savvy Fellow include fundraising for your business, building the right team to execute your business strategies, building buzz around your product or service, achieving product-market fit, scaling into new markets and verticals, and building customer loyalty and retention.  E-Learning:Â Savvy Fellowship kicks off with a rigorous 12-weeks e-learning experience. As a Savvy Fellow, you will learn everything from ideation to scaling. Some of the things youâll learn during the program are âunderstanding your customerâ, âbuilding a product or service that effectively solves their key challengesâ, and âeffectively positioning your solution in the market.âWeek 1: Understanding Your CustomerWeek 2: Building the Right Product or ServiceWeek 3: Beating Your CompetitorsWeek 4: Understanding Your Target MarketWeek 5: Drafting the Right Revenue ModelWeek 6: Your Customer Acquisition, Activation & Retention StrategyWeek 7: Your OperationsWeek 8: Setting the Right Business StructureWeek 9: Your Go-To-Market StrategyWeek 10: Building the Right TeamWeek 11: Your Fundraising StrategyWeek 12: Securing the Right PartnersSee More: Allard Prize for International Integrity 2022Assessment:Â During the 12 weeks of learning, unlearning, and relearning, you can test your understanding by taking our weekly quizzes. The quizzes are a combination of multiple choices, Yes or No, and True or False. Assessments are the best way to identify your strengths and areas of weaknesses. Knowing your weaknesses helps you work effectively on them.Peer Mentorship:Â They have introduced peer-to-peer mentorship, which they have found very effective. The motto at Savvy is: âBe Your Fellowâs Keeper.â So, since all Savvy Fellows donât have the same level of experience, more experienced and knowledgeable Fellows will help guide the others.Expert Mentorship:Â Savvy Fellows get weekly expert mentorship from about 900 renowned experts across various industries. The Fellows are expected to effectively transform all their learnings from the expert mentorship sessions, into meaningful and measurable societal impact.Post-Fellowship: After 12 weeks, youâll receive a Certificate of Completion to proudly share with your professional network. Thatâs not all. Youâll still find the Savvy platform useful as they constantly share weekly articles on impact entrepreneurship, personal branding, capacity building, and professional opportunities. So, your Savvy Fellowship account will be useful even after you complete the intensive 12-week virtual Fellowship program.Savvy Prize:Â At the end of every year, Savvy Fellows compete for the $3,000 Savvy Prize, which seeks to recognize and support the efforts of Savvy Fellows working to solve some of the worldâs most pressing problems through innovative and sustainable ways. The Savvy Prize comes in cash prizes, product development support, and marketing endeavors.Benefits from Savvy Global FellowshipBecoming a Savvy Fellow is an exceptional opportunity for you to:Firstly, Identify your ideal target customer, and build a product or service that exceeds their expectations.Secondly, Make your product or service stand out from competing or substitute solutions in the market.Thirdly, Draft a solid go-to-market strategy, revenue model, and customer acquisition strategy for your business.Additionally, Optimize your business operations, delegate properly, and build a winning team to execute your business strategies.Moreover, Identify the right legal structure for your business, raise capital for your business, and forge strong strategic partnerships that will help you scale your business.Meet and interact with renowned business experts across various industries.Share your experiences with other Fellows, and learn from them.Furthermore, Explore industries beyond your daily work and expand your expertise.Similarly, Strengthen your work through new connections, skills, and ideas.Lastly, Join a global alumni network of over 5,000 entrepreneurs, to help you seek innovative solutions to common business challenges.See More; Fully Funded International Excellence Scholarship 2022, Scotland",-,DeadlineVaries,-," Required for Savvy Global FellowshipOpen to aspiring and early-stage entrepreneurs around the world. There is no geographical, ethnic, or academic restriction.They accept new Fellows between the ages of 18 â 40, who can demonstrate in their application their passion to learn and create lasting change in their community (and the world.) However, they consider applicants above the age of 40, with at least 5 years of work or entrepreneurial experience.ApplicationsThey have no application deadline. Savvy is a fully-funded Fellowship program, so selected Fellows are not required to pay any fee.  Lastly, It is important to visit the official website link found below to access the application form.Correspondingly, Join us onÂ TelegramÂ for more opportunities!Similarly, VisitÂ oyaop.comÂ andÂ oyaschool.comÂ for more scholarship opportunities.",-,https://savvyfellows.com/about/,-,Inglés,-,-,-,-,-,-
