,Titulo,Tipo,Tags,Nivel Educativo,Categoria,Descripcion,Ubicacion,Fecha Inicio,Fecha Final,Requisitos,Url de IMAGEN,Url (PAGINA WEB),Carreras,Idiomas,Semestre,Vacantes,Calificacion,Premio,Remuneracion,Costo
7,Paul Profeta Entrepreneur-in-Residence Program 2022 | Funded,Beca," Tags: Academic Jobs, career opportunities, Competitions and Awards, fellow opportunities Opportunities for youths, Fellowships, Fellowships 2020, fully funded, fully funded fellowships, fully funded opportunities, fully funded scholarships, funded fellowship, Funded Fellowships, funded opportunities, international fellowships, International Scholarships, opportunities, opportunities for entrepreneurs, opportunities for students, opportunities for youths, Opportunity, opportunity for student, oya opportunities, oyaop, oyaop.com, v, www.oyaop.com, youths",Universidad,Emprendimiento,"Applications for theÂ Paul Profeta Entrepreneur-in-Residence Program 2022Â are now open. The Profeta Entrepreneur-In-Residence (EIR) program provides training, access, and support to black, indigenous, and people of color who are interested in becoming high-tech, high-growth entrepreneurs. The EIR Fellows receive a financial stipend, access to entrepreneurial training and mentors, and an opportunity to build startups grounded in university intellectual property, partnered with researchers. The inaugural cohort will start in Spring 2022.See More: Colony on Mars || 2022 Architecture CompetitionsProgram ComponentsStipend:Â $13,000 stipend over the course of 6 months, provided in monthly installments.Programming:Â Access to all VentureLink entrepreneurial programs, including cohort educational sessions, Linkups, and Coffee Club.Residency:Â Expected 5 days/week working and learning. This does not need to be in the VentureLink co-working space, but must be productively spent.Network:Â Access to 1:1 consulting and support from the NJII Entrepreneurship Division, mentorship from industry and startup experts, and connections to Investors (upon readiness).",-,-,-," for Paul Profeta Entrepreneur-in-ResidenceThis program supports black, indigenous, and people of color ONLY.You do not need entrepreneurial experience to be qualified for this program. They are open to individuals of all professional backgrounds, although they do look for people with entrepreneurial aptitude and the tenacity to build a high-growth startup.Individuals interested in this program must be located within commuting distance from Newark, NJ.You need a minimum of a high school diploma or GED to apply, but continuing education is preferred.They are looking for individuals who are open to risk and feedback, willing to think creatively and act flexibly, and those who focus on outcomes and results.Application of Paul Profeta Entrepreneur-in-ResidenceFirstly, Submit Your ApplicationSecondly, Selected applicants will be invited for an interviewThirdly, ProjectÂ  â details will be provided if an applicant makes it to this stepLastly, SelectionSee More: Earth Photo 2022 || enabling a better understanding of the worldLastly, It is important to visit the official website link found below to access the application form.  Correspondingly, Join us onÂ TelegramÂ for more opportunities!Similarly, VisitÂ oyaop.comÂ andÂ oyaschool.com for more scholarship opportunities.  ",-,https://www.venturelink.org/entrepreneurinresidence,-,Inglés,-,-,-,-,-,-
8,Enrich in Africa SBC Virtual Acceleration 2022,Beca," Tags: 2022, Acceleration Program, Accelerator Program, Accelerator Program 2022, Accelerator Squared, career opportunities, ENRICH, Enrich in Africa, Enrich in Africa SBC Virtual Acceleration, Enrich in Africa SBC Virtual Acceleration 2022, Entrepreneur Bootcamp, Entrepreneur Bootcamp 2022, entrepreneurship, entrepreneurship bootcamp, fully funded, fully funded opportunities, funded opportunities, opportunities, opportunities for entrepreneurs, opportunities for startups, opportunities for youths, opportunitties for youths, Opportunity, opportunity for Startups, oya opportunities, oyaop, oyaop.com, SBC Virtual Acceleration, startups, Workshop, www.oyaop.com, youths",Universidad,Emprendimiento,"If you are an African/European startup or SME that wants to develop its business in Europe or Africa then Apply to this virtual programme and receive lifetime access to Accelerator Squared! Accelerator Squared is the online digital acceleration platform where you can accelerate innovation, anytime, anywhere.Click: Fetola Youth Startup Accelerator (YSA) 2022   ",-,-,-," criteria for the Virtual AccelerationTo be eligible to apply, a company must have:Â at least 2 years old of operationÂ a turnover of at least $15 000 in 2021also, at least 2 employees and/or co-foundersMoreover, its headquarters based in an African/European countryPrizesThe 10 laureates will benefit from a virtual acceleration by having life-time access to the Accelerator Squared platform.Also, Laureates will have access to dozens of modules online to go through during their own time.The prizes offered include only what is indicated, to the exclusion of anything else. The prizes described above shall not be taken back or exchanged for other objects or services, whatever their value, and shall not be subject to any cash consideration.  Also check out: UNICEF Innovative Fund for Blockchain Startup General Calendar of the Calls for Application2022-01-03: Launch of the call for application2022-03-14: Selection of the 10 projects for quarter 12022-03-31: Announcement of the results2022-06-13: Selection of the 10 projects for quarter 22022-06-30: Announcement of the results2022-09-12: Selection of the 10 projects for quarter 32022-09-30: Announcement of the results2022-12-12: Selection of the 10 projects for quarter 42023-01-03: Announcement of the results2023-03-13: Selection of the 10 projects for quarter 52023-03-31: Announcement of the results2023-06-12: Selection of the 10 projects for quarter 62023-06-30: Announcement of the results2023-09-11: Selection of the 10 projects for quarter 72023-09-29: Announcement of the results2023-12-04: Selection of the 10 projects for quarter 82023-12-22: Announcement of the resultsYou might also like: Young Social Entrepreneurs (YSE) Global How to register?10 – 15 start-ups will be selected every quarter for the next 2 years, starting in March 2022.Applicants should fill in the registration form and will receive a confirmation of their registration by e-mail to the address given in the registration form. There is no closing application deadline. Therefore, your application will still have the opportunity for consideration for the next one. ",-,https://enrich-in-africa-project.eu/programmes,-,Inglés,-,-,-,-,-,-
9,Call for Pitches: AWiM Reporting Program 2022,Beca," Tags: Academic Jobs, career opportunities, Competitions and Awards, fellow opportunities Opportunities for youths, Fellowships, Fellowships 2020, fully funded, fully funded fellowships, fully funded opportunities, fully funded scholarships, funded fellowship, Funded Fellowships, funded opportunities, international fellowships, International Scholarships, opportunities, opportunities for entrepreneurs, opportunities for students, opportunities for youths, Opportunity, opportunity for student, oya opportunities, oyaop, oyaop.com, v, www.oyaop.com, youths",Universidad,Emprendimiento,"Submit your pitch for theÂ African Women in the Media (AWiM) Africa Environment Reporting Program 2022. AWiM is calling for pitches that will call attention to the gendered aspect of environmental issues in Africa. They are particularly interested in in-depth stories that explore environmental solutions with a focus on any of the 12 elements of the African Green Stimulus Program. Journalists could also highlight the impact of the Covid-19 pandemic on ecosystems, biodiversity, conservation, waste management and other issues related to the broader ecological challenges in Africa which affect women.See More: Brenthurst Foundation Fellowship Program 2022 | FundedPitches that focus on stories that have not been widely covered are preferred. So be on the lookout for issues that provide unique gendered angles to environmental challenges. Topics that have widely been covered are less likely to be selected.  Benefits from AWiM Reporting ProgramJournalists commissioned to produce stories will have access to training by AWiM.Commission fee is USD $100 per story.",Africa,-,-," for AWiM Reporting ProgramApplicants must be women journalists based in Africa. Applicants can be from any country in Africa. For the purposes of this reporting grant opportunity, they will only be accepting applications in English.Applicants must either have a working understanding of English or be able to translate their work.Pitches are open to women journalists working in any medium (e.g. online, print, television, radio etc.) and other media practitioners with a history of covering environmental beat. Pitches from freelance reporters and staff from all types of media organisations â international, national, local and community-based are encouraged. Where you are staff of a media organisation, indicate in your pitch if your organisation would like to co-publish your story.The Story FormatThey expect to award 60 story grants in total for the duration of the project. While out on the field, ensure that womenâs voices are well captured, and observe all safety measures where requested, access to AWiMâs safety for journalist training can be provided.  Each story must be accompanied with quality pictures, be verified, fact-check and go through the usual journalistic scrutinyWhere your story is republished in your affiliated media, this must be with your byline and indicate at the end that it is produced as part of theÂ AWiM/UNEP Africa environmental journalism program).Application of AWiM Reporting ProgramAll pitches must be no more than 250 words. It should highlight the key issue you want to focus on, why it is relevant to the program, the extent to which it is under reported, and what the gender angle is. Also indicate why you are the right person to report it and the access you already have.Remember to read theÂ editorial policy and submissions guidelineÂ before sending your pitch.All pitches for this grant should be sent toÂ [email protected]See More: King AbdulAziz University Scholarship in Saudi Arabia 2022/23 | FundedLastly, It is important to visit the official website link found below to access the application form.Correspondingly, Join us onÂ TelegramÂ for more opportunities!Similarly, VisitÂ oyaop.comÂ andÂ oyaschool.comÂ for more scholarship opportunities.",-,https://awimnews.com/the-network/write-for-us/,-,Inglés,-,-,-,-,-,-
10,Top 5 Entrepreneurship Events for February 2022,Beca,-,Universidad,Emprendimiento,"Grab your opportunity to learn and grow your business with professional events as well as workshops. Here are the top five lists of Entrepreneurship Events you can register yourself with this month. Get a chance to expand your knowledge and also the connection around the globe!1. Junior Chamber International Creative Young Entrepreneur Program 2022The creative Young Entrepreneur Program challenges young entrepreneurs to critically and creatively think by requiring them to provide an in-depth business model, their marketing position, and strategic goals on how their venture will begin to earn a profit and become sustainable.This program will award the winners of the competition for their efforts and also play an important role to inspire and promote participants to create innovative new businesses and therefore jobs to tackle the economic challenges caused by the Covid-19 pandemic.Deadline:27 February 2022Event Country:NigeriaOpen to:AllOrganizer:JCIClick here to learn more!   2. Westerwelle Young Founders Program 2022 | Fully Funded   The Young Founders Programme is a 6-month fellowship for outstanding young entrepreneurs from emerging markets. It brings together leaders from all over the world, who are united in the pursuit to achieve entrepreneurial greatness. They offer targeted support to scale our foundersâ ventures and develop their leadership abilities.The participants will gain the benefits of Mentoring, Peer Learning, Expert Sessions, Buddy Programme, Berlin Conference, and many more.Deadline:13 March 2022Event Country:GermanyOpen to:AllOrganizer:Westerwelle FoundationClick here to learn more!3. Keystone Startup Advantage || Incubator Program for Startups If you are an innovator or a tech startup or SME with an innovative solution, take your chance to support your business idea through the Keystone Startup Advantage!The Keystone Startup Advantage Program is a specialized incubator program with offerings to address the needs of Startup businesses. It is a Social Enterprise Initiative which aligns with the United Nations Envision #2030 Sustainable Development Goal (UN SDG) 8:âTo promote sustained, inclusive and sustainable economic growth, full and productive employment, and decent work for allâ.Through the Keystone Startup Advantage Program, Keystone as a bank aims to impact 100 Startups annually and up to 1,000 Startups in the next 5 years.Deadline:28 February 2022Event Country:NigeriaOpen tostartupsOrganizerKeystone BankClick here to learn more!4. World Entrepreneurs Investment Forum (WEIF) 2022 If you are eager to join Advanced Entrepreneurship Training, get One-to-One Mentoring Sessions, have Media Exposure, Connect with International Experts, and join the entrepreneurship Rally Finale then WEIF is perfect entrepreneurship opportunity for you.Â WEIF 2022 will address the main theme âAchieving the SDGs through Entrepreneurship, Innovation and Investment Post COVID 19â and will encompass a number ofÂ entrepreneurship and innovation sessions.Â Event Date:28 March 2022Â toÂ 31 March 2022Deadline:28 February 2022Event Country:UAEOpen toAllOrganizerIslamic Corporation Youth ForumClick here to learn more!5. Africa Oxford Health Innovation Platform (AfOx-HIP)TheÂ Africa Oxford Health Innovation PlatformÂ (AfOx-HIP) is a multi-disciplinary program to support African innovators develop new solutions to Africaâs health challenges. It connects research to industry to tackle prevention, early diagnosis, as well as treatment through impact investment and innovation.AfOx-HIP is open to working in any scientific discipline, including outside life sciences and engineering sciences, as well as any type of technology leading to the creation of solutions towards disease prevention, diagnosis, management, and treatment.Deadline31 March 2022Open toAll African CountriesOrganizerAfrica Oxford Initiative Click here to learn more! ",-,Deadline:27 February 2022,-,"    DetailsGrab your opportunity to learn and grow your business with professional events as well as workshops. Here are the top five lists of Entrepreneurship Events you can register yourself with this month. Get a chance to expand your knowledge and also the connection around the globe!1. Junior Chamber International Creative Young Entrepreneur Program 2022The creative Young Entrepreneur Program challenges young entrepreneurs to critically and creatively think by requiring them to provide an in-depth business model, their marketing position, and strategic goals on how their venture will begin to earn a profit and become sustainable.This program will award the winners of the competition for their efforts and also play an important role to inspire and promote participants to create innovative new businesses and therefore jobs to tackle the economic challenges caused by the Covid-19 pandemic.Deadline:27 February 2022Event Country:NigeriaOpen to:AllOrganizer:JCIClick here to learn more!   2. Westerwelle Young Founders Program 2022 | Fully Funded   The Young Founders Programme is a 6-month fellowship for outstanding young entrepreneurs from emerging markets. It brings together leaders from all over the world, who are united in the pursuit to achieve entrepreneurial greatness. They offer targeted support to scale our foundersâ ventures and develop their leadership abilities.The participants will gain the benefits of Mentoring, Peer Learning, Expert Sessions, Buddy Programme, Berlin Conference, and many more.Deadline:13 March 2022Event Country:GermanyOpen to:AllOrganizer:Westerwelle FoundationClick here to learn more!3. Keystone Startup Advantage || Incubator Program for Startups If you are an innovator or a tech startup or SME with an innovative solution, take your chance to support your business idea through the Keystone Startup Advantage!The Keystone Startup Advantage Program is a specialized incubator program with offerings to address the needs of Startup businesses. It is a Social Enterprise Initiative which aligns with the United Nations Envision #2030 Sustainable Development Goal (UN SDG) 8:âTo promote sustained, inclusive and sustainable economic growth, full and productive employment, and decent work for allâ.Through the Keystone Startup Advantage Program, Keystone as a bank aims to impact 100 Startups annually and up to 1,000 Startups in the next 5 years.Deadline:28 February 2022Event Country:NigeriaOpen tostartupsOrganizerKeystone BankClick here to learn more!4. World Entrepreneurs Investment Forum (WEIF) 2022 If you are eager to join Advanced Entrepreneurship Training, get One-to-One Mentoring Sessions, have Media Exposure, Connect with International Experts, and join the entrepreneurship Rally Finale then WEIF is perfect entrepreneurship opportunity for you.Â WEIF 2022 will address the main theme âAchieving the SDGs through Entrepreneurship, Innovation and Investment Post COVID 19â and will encompass a number ofÂ entrepreneurship and innovation sessions.Â Event Date:28 March 2022Â toÂ 31 March 2022Deadline:28 February 2022Event Country:UAEOpen toAllOrganizerIslamic Corporation Youth ForumClick here to learn more!5. Africa Oxford Health Innovation Platform (AfOx-HIP)TheÂ Africa Oxford Health Innovation PlatformÂ (AfOx-HIP) is a multi-disciplinary program to support African innovators develop new solutions to Africaâs health challenges. It connects research to industry to tackle prevention, early diagnosis, as well as treatment through impact investment and innovation.AfOx-HIP is open to working in any scientific discipline, including outside life sciences and engineering sciences, as well as any type of technology leading to the creation of solutions towards disease prevention, diagnosis, management, and treatment.Deadline31 March 2022Open toAll African CountriesOrganizerAfrica Oxford Initiative Click here to learn more! ",-,https://oyaop.com/opportunities/entrepreneurship-events/,-,Inglés,-,-,-,-,-,-
11,Google Hustle Academy || Entrepreneur Bootcamp 2022,Beca," Tags: 2022, Accelerator Program, Accelerator Program 2022, career opportunities, Entrepreneur Bootcamp, Entrepreneur Bootcamp 2022, entrepreneurship, entrepreneurship bootcamp, fully funded, fully funded opportunities, funded opportunities, google, Google Hustle Academy, Google Hustle Academy || Entrepreneur Bootcamp 2022, Incubator Program 2022, opportunities, opportunities for entrepreneurs, opportunities for startups, opportunities for youths, Opportunity, opportunity for Startups, oya opportunities, oyaop, oyaop.com, SME, startups, Tech Startup, virtual sessions, Workshop, www.oyaop.com, youths",Universidad,Emprendimiento,"The Google Hustle Academy is now here to help your business power up to the next level. Get access to live training sessions, 1-1 mentorship, as well as masterclasses by industry leaders, all for free! This one-week Bootcamp, delivered online by subject matter experts, is designed to help small businesses grow by increasing revenue, positioning for investment, and building a sustainable business for the future.BenefitsLive workshops led by expert trainers; are designed to be practical, interactive and hands-onPeer networking sessionsGuest speaker eventsIn addition, opportunities for 1:1 mentoring and supportClick: Junior Chamber International Creative Young Entrepreneur Program 2022   ",-,-,-,"Business operating in Nigeria, Kenya, and also in South Africa.Businesses should have already created a business plan, defined their product/service offering, and be looking to now scale this.The Hustle Academy is open to businesses that have at least 2 full-time employees and have been operating for over 12 monthsMoreover, businesses that have generated profit in the last 12 months or are 1-3 months away from breaking even.Topics CoveredDay 1: Business StrategyUndertake a SWOT analysis of your business strategy-to-dateUse this to design a growth plan for the coming year which focuses on the steps your business can take to attract new customers and increase salesAlso check out: Keystone Startup Advantage || Incubator Program for Startups Day 2: Business DevelopmentDetermine your revenue goals for the next yearUnderstand your audienceAlso, Identify market trendsConduct competitor analysisDefine your unique value propositionIn addition, discover ways in which you can move customers through the consumer funnelDay 3: Business MarketingUnderstand the key digital marketing channels available to your businessReflect upon the best channels for youDiscover how to create engaging content to attract as well as convert customersLearn how to measure your overall successDay 4: Financial PlanningExplore the steps you can take to plan your finances and also create financial forecasts to secure investmentBuild upon this by exploring the different funding routes available as well as identify possible options for your businessYou might also like: Tech For Black Founder Companies || Social Impact Program   Day 5: Pitching for SuccessDiscover top tips you can implement to build your own pitch deck for investors to help your business secure fundingUtilize the training delivered throughout the week to create your very own pitch deckHow to ApplyTo apply for the program, simply click the button below to complete the application form.Once you have completed the form, a member of the team will be in touch to progress your application and answer any questions you have.APPLY HEREÂ ",-,https://events.withgoogle.com/google-hustle-academy/,-,Inglés,-,-,-,-,-,-
12,Tech For Black Founder Companies || Social Impact Program,Beca," Tags: Black Founder Companies, Braze, career opportunities, entrepreneurship, fully funded, fully funded opportunities, funded opportunities, opportunities, opportunities for entrepreneurs, opportunities for youths, Opportunity, Opportunity for Black Founder Companies, oya opportunities, oyaop, oyaop.com, Social Impact Program, Social Impact Program 2022, Tech For Black Founder Companies || Social Impact Program, Tech For Black Founder Companies 2022, Tech for Black Founders, Tech for Black Founders 2022, www.oyaop.com, youths",Universidad,Emprendimiento,"Braze is launching a call for applications to accept 15 Tech for Black Founder companies this 2022. Tech For Black Founders Program is an effort to provide concrete, long-lasting support, Braze along with Alloy partners Amplitude, Branch, mParticle, and Radar. Through this initiative, companies are making it simple and free for Black founders to accelerate their growth through a variety of technologies.Click: FAST Accelerator || Scaling Africaâs Digital Ecosystem   Since the launch of the program, more than 40 companies, including Airtable, AWS, Notion, and Stripe, have joined and donated tens of millions of dollars of free technology to Black-founded businesses.Braze is a comprehensive customer engagement platform that powers relevant and memorable experiences between consumers and the brands they love. Context underpins every Braze interaction, helping brands foster human connection with consumers.  Also check out: Next Generation Women Leaders EMEA Qualification ",-,-,-," for Access:Black Founder in the US or EMEABootstrapped Business or less than $30M in Venture FundingUnder 100 EmployeesYou might also like: Oracle for Startups|| Offer in Cloud Computing Benefits:A free Growth package for 12 monthsGrowth 6 onboarding services to get you up and running (live within 6 weeks unless customers also purchase SMS)Unlimited Push Notifications, Webhooks, and In-App/In-Browser messaging for up to 250,000 Monthly Active UsersAlso, email costs covered up to 10M emails and two IP addresses1 Current – Messaging Events integrationAccess to SDKs as well as APIsMoreover, braze DocumentationOver 25 hours of educational marketing videos and content in Braze LABs",-,https://www.braze.com/techforblackfounders,-,Inglés,-,-,-,-,-,-
