,Titulo,Tipo,Tags,Nivel Educativo,Categoria,Descripcion,Ubicacion,Fecha Inicio,Fecha Final,Requisitos,Url de IMAGEN,Url (PAGINA WEB),Carreras,Idiomas,Semestre,Vacantes,Calificacion,Premio,Remuneracion,Costo
25,World’s Largest Python Global Summit,Beca,-,Universidad,Emprendimiento,"World’s Largest Python Global Summit The biggest Python WEB Event of the Year!Top speakers from Netflix, TikTok, Google, Microsoft, IBM, Red Hat, MongoDB and other world-leading companies!Offline events are gone for some time, but the tech world doesn’t slow down.World’s Largest Python Global SummitThe Python community needs the platform to share latest updates and use cases to improve coding skills and get architectural insights. We aim to provide an online event for Python geeks from all over the world to share what’s new in the domain.Geekle has the unique experience to gather huge tech summits with 11’000+ attendees with 95% of free users registered in other tech domains. Now we hope to make something the world has never seen before for the Python Community.Python is the whole universe. We understand specific sub-domains like Python Web, Python for ML/AI and Python for Testing. Thatâs why we separated Python into three unique events. Now we are ready to present the Python WEB Global Summitâ20.What’s waiting for you: 2 tracks: Junior Free & Senior Price from $49 to $300 24 hours of NonStop tech talks from TopNotch Speakers 40+ speakers from Top Companies from all over the globe Tons of use cases 50+ tech talks Q&A sessions and panel discussions 15,000+ attendees expected Killer content from Python Code Masters No pre-recorded performances, only live performances.More Info: >> https://python.geekle.us/ <<Don’t miss your chance to immerse yourself into 24 hours of non-stop tech talks. Learn the best Python WEB Practices and about the latest updates without leaving your home.We would like to draw your attention! There will be 2 Tracks at the summit.1) SENIOR TRACK – for Middle and Senior Software Developers, Solution Architects, and CTO. Deep tech content. Price from $ 49 to $ 300 depending on the day of purchase.What’s included in Senior ticket:Live stream Access to recordings Access to Q&A sessions Workshops discount Slack chat access 25% off next event2) JUNIOR TRACK – for Junior Python developers entry-level content. Absolutely FREE!What’s included in Junior ticket: Live stream Access to Q&A sessionsLearn More Online Courses",-,-,-,"    DetailsWorld’s Largest Python Global Summit The biggest Python WEB Event of the Year!Top speakers from Netflix, TikTok, Google, Microsoft, IBM, Red Hat, MongoDB and other world-leading companies!Offline events are gone for some time, but the tech world doesn’t slow down.World’s Largest Python Global SummitThe Python community needs the platform to share latest updates and use cases to improve coding skills and get architectural insights. We aim to provide an online event for Python geeks from all over the world to share what’s new in the domain.Geekle has the unique experience to gather huge tech summits with 11’000+ attendees with 95% of free users registered in other tech domains. Now we hope to make something the world has never seen before for the Python Community.Python is the whole universe. We understand specific sub-domains like Python Web, Python for ML/AI and Python for Testing. Thatâs why we separated Python into three unique events. Now we are ready to present the Python WEB Global Summitâ20.What’s waiting for you: 2 tracks: Junior Free & Senior Price from $49 to $300 24 hours of NonStop tech talks from TopNotch Speakers 40+ speakers from Top Companies from all over the globe Tons of use cases 50+ tech talks Q&A sessions and panel discussions 15,000+ attendees expected Killer content from Python Code Masters No pre-recorded performances, only live performances.More Info: >> https://python.geekle.us/ <<Don’t miss your chance to immerse yourself into 24 hours of non-stop tech talks. Learn the best Python WEB Practices and about the latest updates without leaving your home.We would like to draw your attention! There will be 2 Tracks at the summit.1) SENIOR TRACK – for Middle and Senior Software Developers, Solution Architects, and CTO. Deep tech content. Price from $ 49 to $ 300 depending on the day of purchase.What’s included in Senior ticket:Live stream Access to recordings Access to Q&A sessions Workshops discount Slack chat access 25% off next event2) JUNIOR TRACK – for Junior Python developers entry-level content. Absolutely FREE!What’s included in Junior ticket: Live stream Access to Q&A sessionsLearn More Online Courses",-,https://python.geekle.us,-,Inglés,-,-,-,-,-,-
26,Istanbul Youth Summit in Turkey 2021,Beca,-,Universidad,Emprendimiento,"Istanbul Youth Summit (IYS) 2021 is the fourth International Summit organized by Youth Break the Boundaries (YBB) Foundation in Istanbul. This summit will encourage future leaders who break the boundaries of their abilitiesÂ  to discuss and take action in âPublic leadership through the crisis.â Before you continue to fill out this form, there are five steps that you have to do:Make sure you follow @youthbreaktheboundaries and @istanbulyouthyouthsummit on InstagramEvery applicant is required to make a twibbon. You can download the twibbon and instruction here.Â Then, upload your twibbon on Instagram or Facebook with a caption about âPublic leadership through the crisis.â, tag 5 friends and our instagram account @istanbulyouthsummitÂ  with the hashtag #YBB #IYS #IYS2021 #youthbreaktheboundariesÂ  #istanbulyouthsummit (Donât forget to screenshot your twibbon on instagram or facebook, because you are required to upload the screenshot in the form.)Share this posterÂ  program to minimum 3 social media groups. Share of publications can be done by:WhatsApp (Click Here) => click the three dots on the top right corner => Click âShareÂ  in Â  WhatsAppâ => Share it to minimum 3 WhatsApp Groups.Instagram => Mention 5 of your friends on this post.Then you are required to make a payment.For Indonesian participants: fee for Indonesian applicants Rp 125.000Â  to bank account: Meldi Latifah Saraswati Account no: 0373863758, BCA (Bank Central Asia)For abroad participants: fee for Foreign applicants $10Â  to bank account : paypal.me/aldisubakti or Paypal mail at [email protected], Paypal paymentAfter you are done with all the instructions, now you can fill out this form HERE  ",Turkey,CityIstanbul,-,"    DetailsIstanbul Youth Summit (IYS) 2021 is the fourth International Summit organized by Youth Break the Boundaries (YBB) Foundation in Istanbul. This summit will encourage future leaders who break the boundaries of their abilitiesÂ  to discuss and take action in âPublic leadership through the crisis.â Before you continue to fill out this form, there are five steps that you have to do:Make sure you follow @youthbreaktheboundaries and @istanbulyouthyouthsummit on InstagramEvery applicant is required to make a twibbon. You can download the twibbon and instruction here.Â Then, upload your twibbon on Instagram or Facebook with a caption about âPublic leadership through the crisis.â, tag 5 friends and our instagram account @istanbulyouthsummitÂ  with the hashtag #YBB #IYS #IYS2021 #youthbreaktheboundariesÂ  #istanbulyouthsummit (Donât forget to screenshot your twibbon on instagram or facebook, because you are required to upload the screenshot in the form.)Share this posterÂ  program to minimum 3 social media groups. Share of publications can be done by:WhatsApp (Click Here) => click the three dots on the top right corner => Click âShareÂ  in Â  WhatsAppâ => Share it to minimum 3 WhatsApp Groups.Instagram => Mention 5 of your friends on this post.Then you are required to make a payment.For Indonesian participants: fee for Indonesian applicants Rp 125.000Â  to bank account: Meldi Latifah Saraswati Account no: 0373863758, BCA (Bank Central Asia)For abroad participants: fee for Foreign applicants $10Â  to bank account : paypal.me/aldisubakti or Paypal mail at [email protected], Paypal paymentAfter you are done with all the instructions, now you can fill out this form HERE  ",-,http://iys.youthbreaktheboundaries.com,-,Inglés,-,-,-,-,-,-
27,International Youth Initiative Program 2020,Beca," Tags: career opportunities, competitions 2020 oyaop, competitions in 2020, Exchange Programs, exchange programs 2020, exchange programs for youths, full funded exchange programs, fully funded exchange programs 2020, funded exchange program, funded exchange programs 2020, international competitions, opportunities, opportunities for youths, oya opportunities, oyaop, oyaop.com, www.oyaop.com, youths",Universidad,Emprendimiento,"The International Youth Initiative Program (YIP) is a 10-month residential societal entrepreneurship training for 18-28 years olds based in Sweden. It offers a holistic educational program that expands global understanding and personal awareness. YIP aims to strengthen young peopleâs capacity to take the personal and collective initiative in the face of current global realities. DetailsÂ The YIP program moves through seven different stages or course blocks. In order to create a holistic education, YIP participants are given an opportunity to dive into different topic areas. Within each of the seven-course blocks are a series of one-week-long courses in the morning and afternoon activities that balance intellectual, socio-emotional, and practical knowledge. These are listed in the Curriculum section above and the Afternoon section below. The morning courses consist of contributor-led content and afternoon of applied mentor-led practices. These two tracks run throughout the year. They align with the educational principles and aim to practically teach the YIP ethos in an accessible way.",Sweden,CityJÃ¤rna,-,"This opportunity is for the candidates who are  18 and 28 years old.Fluent in English.Looking forward to connecting with like-minded change-makers.Looking for an education that empowers them.Willing to develop your cognitive, social-emotional, and creative intelligence.Willing to create positive shifts in yourself, others, and the world.Aware of today’s challenges and willing to create a better future.CostThe International Youth Initiative Program Cost is SEK 100.000 per participant for the whole 10 month program period, including Sweden-Outpost return ticket. Specifically, it includes:The Program: courses, course materials, and evening activitiesFood: organic meals (breakfast, lunch & dinner from Monday â Friday, not including holidays)Accommodation (single-sex twin-share bedrooms on campus)Travel: 8000 SEK for the travel to and from the international internship, as well as Sweden-Outpost return ticket.Transportation (in connection with the curriculum)BenefitsAll eligible participants will receive a Certificate of Completion at the yearâs end. In addition all participants will receive an individual portfolio with Certificates of Qualification from each completed course during the program. The YIP Certificates of Qualification comply with the European Credit Transfer System (ECTS.) They do not grant any direct academic degree. In the past participants have been able to use their YIP certificates towards credits for their bachelor and/or master programs. Through the partnership of YIB with Alanus University, all credits are accepted and credited for the BA in Social Entrepreneurship.  Visit this link for more information",-,https://yip.se,-,Inglés,-,-,-,-,-,-
28,UNICEF Innovation Fund for Startups,Beca," Tags: awards, competitions, Competitions and Awards, Fund for Startup, Funds, Innovation Fund for Startup, international awards, international competitions, international fund, international funding, international funds, international prizes, opportunities, opportunities for student, opportunities for students, opportunities for youth, opportunities for youths, Opportunity, opportunity for student, opportunity for students, opportunity for youth, opportunity for youths, oyaop, oyaop.com, prize, prizes, UNICEF, UNICEF Innovation Fund, UNICEF Innovation Fund for Startup, united nations, United Nations Fund, United Nations Funding, www.oyaop.com",Universidad,Emprendimiento,"Financial and technological support from UNICEFâs Venture Fund is available for companies that can show a strong founding team and a clear path to improving the lives of children. If youâve got a startup registered in one of UNICEFâs program countries and have a working, open-source prototype (hardware, software or content) showing promising results, the UNICEF Innovation Fund is looking for you. UNICEF invests in solutions that can impact the lives of the most vulnerable children. Moreover, it finds these solutions clustered around $100billion industries in frontier technology spaces, such as blockchain; UAVs; virtual and augmented reality; 3D printing; machine learning; quantum computing; genetic engineering; Internet of Things; artificial intelligence; nano-satellites; as well as human dynamics.The UNICEF Innovation Fund can help a startup with these kinds of investments up to $90,000 to support the acceleration of your companyâs work. You might need a small amount of money to get your prototype to the stage where the company has proof that the solution works for other people. Maybe you will need another developer or two to design help to communicate what the project can do or some server space. Refactoring something into a new language because the initial one wonât scale. Testing it in a new area. Getting some data points.  UNICEF Innovation Fund for StartupThe startup will receive several benefits from the UNICEF Innovation Fund including Seed Funding, technological assistance as well as networking opportunity.Seed funding: the Fund provides $50-90,000 in equity-free seed funding. The UNICEF Innovation Fund can help to support the acceleration of your companyâs work. The next stage after that proof would be going for more funding private sector investment or grant-funding, or other; depending on the type of technology and solution.  Product and technology development: Receiving investment from the Innovation Fund also gives access to UNICEF Innovationâs Venture team. The team provides technical assistance in emerging technology areas, which is accessible to companies receiving investment. Dedicated advisers can help you select the most appropriate open source license. Further, they can help you create a community around your product and network with leaders in your space.Network across a cohort of similar companies: Support from UNICEF will focus on these technical areas and facilitate access to the most relevant networks. Moreover, you will be directly connected with other groups working on similar solutions, exchange lessons and exchange data and benefit from other contributors to your open source solution.Growing grow your business: We invest in companies with a sustainable approach that will ultimately grow your business and profit. The UNICEF Venture Fund taps into a network of mentors as well as advisers who can help you develop your business model and strategy. We also facilitate access to networks of partners, funders, and investors that can help scale your solutions.Maximizing impact for children: As the worldâs leading organization for children, UNICEF has experts across its Country Offices and partners. Moreover, the experts can advise on the development of your solution. As well as they can provide insight on how to assess its impact and partnerships needed to reach more users.Who is Eligible for the UNICEF Funding?You must be registered as a private company,Further, your company/institution must be registered in a UNICEF program country,Likewise, you are working on open source technology solutions or willing to be open-source under the following licenses or their equivalent:for software, a BSD license,for hardware, a CERN license anddesign or content, a CC-BY license,Moreover, you have an existing prototype of the solution with promising results from initial pilots,Your solution has the potential to positively impact the lives of the most vulnerable children,Also, your project generates publicly-exposed measurable real-time data.How to apply for the UNICEF Innovation Fund?Startup from the UN member countries can apply for the UNICEF Innovation Fund. To apply, the candidates will require to complete and submit the online application form. Moreover, the startup, as well as the project, should meet the Innovation Fund eligibility criteria.",All UN Nations,-,-,"    DetailsFinancial and technological support from UNICEFâs Venture Fund is available for companies that can show a strong founding team and a clear path to improving the lives of children. If youâve got a startup registered in one of UNICEFâs program countries and have a working, open-source prototype (hardware, software or content) showing promising results, the UNICEF Innovation Fund is looking for you. UNICEF invests in solutions that can impact the lives of the most vulnerable children. Moreover, it finds these solutions clustered around $100billion industries in frontier technology spaces, such as blockchain; UAVs; virtual and augmented reality; 3D printing; machine learning; quantum computing; genetic engineering; Internet of Things; artificial intelligence; nano-satellites; as well as human dynamics.The UNICEF Innovation Fund can help a startup with these kinds of investments up to $90,000 to support the acceleration of your companyâs work. You might need a small amount of money to get your prototype to the stage where the company has proof that the solution works for other people. Maybe you will need another developer or two to design help to communicate what the project can do or some server space. Refactoring something into a new language because the initial one wonât scale. Testing it in a new area. Getting some data points.  UNICEF Innovation Fund for StartupThe startup will receive several benefits from the UNICEF Innovation Fund including Seed Funding, technological assistance as well as networking opportunity.Seed funding: the Fund provides $50-90,000 in equity-free seed funding. The UNICEF Innovation Fund can help to support the acceleration of your companyâs work. The next stage after that proof would be going for more funding private sector investment or grant-funding, or other; depending on the type of technology and solution.  Product and technology development: Receiving investment from the Innovation Fund also gives access to UNICEF Innovationâs Venture team. The team provides technical assistance in emerging technology areas, which is accessible to companies receiving investment. Dedicated advisers can help you select the most appropriate open source license. Further, they can help you create a community around your product and network with leaders in your space.Network across a cohort of similar companies: Support from UNICEF will focus on these technical areas and facilitate access to the most relevant networks. Moreover, you will be directly connected with other groups working on similar solutions, exchange lessons and exchange data and benefit from other contributors to your open source solution.Growing grow your business: We invest in companies with a sustainable approach that will ultimately grow your business and profit. The UNICEF Venture Fund taps into a network of mentors as well as advisers who can help you develop your business model and strategy. We also facilitate access to networks of partners, funders, and investors that can help scale your solutions.Maximizing impact for children: As the worldâs leading organization for children, UNICEF has experts across its Country Offices and partners. Moreover, the experts can advise on the development of your solution. As well as they can provide insight on how to assess its impact and partnerships needed to reach more users.Who is Eligible for the UNICEF Funding?You must be registered as a private company,Further, your company/institution must be registered in a UNICEF program country,Likewise, you are working on open source technology solutions or willing to be open-source under the following licenses or their equivalent:for software, a BSD license,for hardware, a CERN license anddesign or content, a CC-BY license,Moreover, you have an existing prototype of the solution with promising results from initial pilots,Your solution has the potential to positively impact the lives of the most vulnerable children,Also, your project generates publicly-exposed measurable real-time data.How to apply for the UNICEF Innovation Fund?Startup from the UN member countries can apply for the UNICEF Innovation Fund. To apply, the candidates will require to complete and submit the online application form. Moreover, the startup, as well as the project, should meet the Innovation Fund eligibility criteria.",-,https://unicefinnovationfund.org/,-,Inglés,-,-,-,-,-,-
29,Fully-funded Cargill Global Scholars Program 2020,Beca," Tags: 2019 scholarships, 2020 scholarships, career opportunities, fully funded opportunities, fully funded scholarships, funded opportunities, Funded Scholarships, global scholarships, International Scholarships, opportunities, opportunities for students, opportunities for youths, oya opportunities, oyaop, oyaop.com, partially funded scholarships, Scholarships, Scholarships for international students, scholarships for youths, www.oyaop.com, youths",Universidad,Emprendimiento,"The Cargill Global Scholars Program (CGSP) is a distinctive, two-year scholarship program that provides financial support to undergraduate students in Brazil, China, India, Indonesia, Russia, and the United States. The program helps to develop leadership development opportunities through seminars, networking events and a one-on-one mentoring program facilitated by Cargill volunteers globally, and an alumni network that will help you keep connected with past, current, and future scholars. The scholarship focuses on building a global network of future leaders who will one day make important contributions to advance business, agriculture and food security.Funding/Financial AidÂ The candidates participating in the Cargill Global Scholars Program 2020 will have the opportunity to receive the following benefits  Annual scholarship award for up to two years, to help off-set any academic-related expenses.Opportunity to participate in a fully-funded In-Country Seminar (Year 1) and Global Seminar (Year 2).Mentorship by Cargill employees to help the scholars identify short and long term academic and goals and will assist in reaching these goals through networking, face-to-face meetings, and communication by email and phone.Similarly, the opportunity to participate in a series of experiential learning modules; leadership development training; coupled with network opportunities with Cargill executives.Furthermore, the chance to become a member of the Cargill Global Scholars Alumni community.Other than financial support, participating students receive leadership development training, membership in the alumni to maintain and create connections, and one-on-one mentoring to equip them with the necessary tools to become future global leaders, decision-makers, and influencers.","Brazil, China, India, Indonesia, Russia, and the United States",DeadlineVaries,-,"Â Candidates must have the following requirements  Citizenship or permanent legal residency of Brazil, China, India, Indonesia, Russia or the United States.Must be attending a partner university in the country of citizenship or permanent legal residency. In addition to that, s/he must be a first or second-year university studentFurthermore, candidates should demonstrate high academic performance as well as leadership potential.While making a decision about the candidates, organizers prioritize the candidates who demonstrate financial need; or are from a disadvantaged or underrepresented group within their country.Follow the official link for more information.",-,https://www.cargillglobalscholars.com/apply/components/,-,Inglés,-,-,-,-,-,-
